{
  "$schema": "https://json-schema.org/draft/2020-12/schema",
  "title": "plugin.json house rules (stricter than upstream)",
  "type": "object",
  "required": ["name", "version", "description"],
  "properties": {
    "name": { "type": "string", "pattern": "^[a-z][a-z0-9-]*$" },
    "displayName": { "type": "string" },
    "version": { "type": "string", "pattern": "^\\d+\\.\\d+\\.\\d+$" },
    "description": { "type": "string" },
    "author": { "type": "object" },
    "homepage": { "type": "string" },
    "repository": { "type": "string" },
    "license": { "type": "string" },
    "keywords": { "type": "array", "items": { "type": "string" } }
  }
}
